<?xml version="1.0" encoding="UTF-8"?>
<stems xmlns="https://www.adambaker.org/mortal-engine/stems"
    xmlns:xsi="http://www.w3.org/2001/XMLSchema-instance" xsi:schemaLocation="../schemata stems.xsd">
    <stem>
        <form lang="wk-LA">don</form>
        <tag>noun</tag>
    </stem>
    <stem>
        <allomorph portmanteau="[Stem][Dative]">
            <form lang="wk-LA">shunga</form>
            <tag>noun</tag>
        </allomorph>
        <allomorph>
            <form lang="wk-LA">shu</form>
            <tag>noun</tag>
        </allomorph>
    </stem>
</stems>
